{
  "schema": "vault_api.v1",
  "op": "decrypt",
  "request_id": "vr-0000000000000002",
  "handle": "vh-0f0f0f0f0f0f0f0f0f0f0f0f0f0f0f0f",
  "binding": {
    "session_id": "ses-0000000000001a2b",
    "placeholder": "[REDACTED:PASSWORD#12]",
    "field_type": "PASSWORD",
    "site": "login.example",
    "element_id": "n7"
  }
}
